{
  "$schema": "https://json-schema.org/draft/2020-12/schema",
  "x-select": ["order"],
  "title": "Order",
  "description": "One order (Or): a dated statement from the commander, held verbatim. The text of an order is never edited, only moved. Filed by identifier, Or001.json.",
  "type": "object",
  "required": ["kind", "id", "date", "text"],
  "properties": {
    "kind": {
      "description": "the word order, which is what chooses this schema",
      "const": "order"
    },
    "id": {
      "description": "this order's identifier, Or and three digits, the same identifier the file is named for",
      "type": "string",
      "pattern": "^Or[0-9]{3}$"
    },
    "date": {
      "description": "the day the commander said it, YYYY-MM-DD",
      "type": "string",
      "pattern": "^[0-9]{4}-[0-9]{2}-[0-9]{2}$"
    },
    "session": {
      "description": "the eight-character id of the session the order was given in",
      "type": "string",
      "pattern": "^[0-9a-f]{8}$"
    },
    "text": {
      "description": "the commander's own words, verbatim and never edited",
      "type": "string",
      "minLength": 1
    },
    "superseded_by": {
      "description": "the identifier of the later order that overrides this one; absent while the order stands",
      "type": "string",
      "pattern": "^Or[0-9]{3}$"
    }
  }
}
