{
  "kind": "order",
  "id": "Or074",
  "date": "2026-09-21",
  "session": "71b94de4",
  "text": "On the pilot's statement that with a shared task list the tandem's rule would be enforced by \"explicit assignment to adversary and source-adversary\": \"would [that] be necessary if the file locking is auto? as long as an adversary grabed an adversary task they would be not interfere?\""
}
