{
  "kind": "order",
  "id": "Or044",
  "date": "2026-09-20",
  "session": "b27e6c01",
  "text": "The files in commanders-desk/out-ideas are ideas not orders. Do an idea exploration team with the commander in the room through the pilot's seat, then a dossier once it settles. After that a refactor team much like the one the pilot suggested, still with a designer but a much richer starting point. Once the ideas settle with a dossier, add them to the fitout mission."
}
