{
  "kind": "order",
  "id": "Or014",
  "date": "2026-09-18",
  "text": "On records: \"every good pilot protects their records. A source is good for official documentation. but for codebase sources... ensure only well researched (by special teammates) sources go in there for a purpose.\" `records/flightcrew/` is for learnings to come; first-look surveys stay in the notepad."
}
