{
  "kind": "order",
  "id": "Or083",
  "date": "2026-09-21",
  "session": "71b94de4",
  "text": "On the pilot's report that the option-maker's addendum used the commander's Quality axis (project fit and small footprint) to argue against the paper's ten proposed new record fields, and that the dossier had dropped the field lists: \"wait be carefull. the axis are for the rosters this team creates, not for this disptaches findings. If the agent \\\"found\\\" ten new keys I want to see them. footprint is for an agent to to say in th middle of a run, \\\"hey what about the size of this change\\\" \\\"can we lean it up but keep same performance\\\"\""
}
