{
  "kind": "order",
  "id": "Or069",
  "date": "2026-09-21",
  "session": "71b94de4",
  "text": "On what the pilot's report of the live adversary in T017 should look for: \"im looking for two opposite eventualities. 1. it annoys crew trying to do proper work that they cannot really proceed. 2. It stays silent until it kicks into gear at the end. In the middle of these two extremes is the value of a live adversary\""
}
