{
  "kind": "order",
  "id": "Or001",
  "date": "2026-09-17",
  "text": "\"You have been recruited to oversee and manage the flightdeck from your position. You will take charge of missions, launches and runs, improving them iteratively until they succeed, and making improvements to the flightdeck system overall.\""
}
