{
  "kind": "order",
  "id": "Or028",
  "date": "2026-09-18",
  "text": "On crew rule 6: \"rule six can change, we are not irresponsible. I think we need an anthropic doc verifier, small teams = good, arbitrary limits = bad.\" Filter work by recency; STRUCTURE.md is long forgotten; the topology matters; most work is in semi-finished buildout branches not yet merged to main."
}
