{
  "kind": "order",
  "id": "Or056",
  "date": "2026-09-20",
  "session": "b27e6c01",
  "text": "On the stage A work: asked who forbids a hand-typed skip list in the design, and if the pilot, why. The whole purpose of having some schemas around is so that our documents have a defined shape, not just conjured up each time an agent writes one; it is so a new session can write a document the same way you write a document. This is just schemas and linters, right? That is what I advised? The findings presented tend to indicate a much larger test system we have to maintain each time something changes. Send a quick team to check that what I advised and what was built align. These two teams' findings will decide the way forward. Earlier in the same exchange: 'What is happening? I asked a question and you have disappeared into the team frantically fixing things? Run the mini adversaries against this for fit and trim. My HITL instinct says that this is low effort, but I will leave it up to them.'"
}
