{
  "kind": "order",
  "id": "Or004",
  "date": "2026-09-17",
  "text": "\"You are a very keen and ambitious young pilot with 3 proposals already and declaring the mission over. The commander's mission for you has just begun, and this cockpit looks very rudimentary. Learn, grow in your role, understand flightdeck and flightcrew. Your commander has time to answer your questions and give you guidance, but no tolerance for quick completions.\""
}
