{
  "kind": "order",
  "id": "Or030",
  "date": "2026-09-18",
  "text": "Two epic missions named by the commander for after the recon: (1) \"teams (of teammates) built by mining our agent dispatch records. So we can dispatch highly effective congruent teams for particular tasks. We will look to extend the cockpit later to accommodate teams.\" (2) \"Now that I have a role one step higher in the chain as the commander, record and mine all my decisions so that the cockpit and flightdeck align over time with my vision, rather than me define it blind session by session. We will mine your daily logs and look to formulate teams to do this task.\" Sparks S006 and S007."
}
